{
  "schemaVersion": "0.1-internal",
  "artifactType": "official-paneforge-companion-request",
  "requestId": "fixture-java-design",
  "createdAt": "2026-08-11T12:00:00+08:00",
  "officialTarget": {
    "product": "official-paneforge",
    "exeName": "paneforge.exe",
    "integrationMode": "external-companion"
  },
  "task": {
    "objective": "Design a new Java service endpoint using repository evidence.",
    "stage": "design",
    "changeType": "new-feature",
    "riskTags": [],
    "authorizedActions": [
      "inspect",
      "design"
    ],
    "requestedActions": [
      "inspect",
      "design"
    ]
  },
  "projectFacts": {
    "provided": [
      "repository",
      "contracts",
      "tests",
      "technologyProfile",
      "javaVersion",
      "springVersion",
      "buildTool",
      "persistenceTechnology"
    ]
  }
}
